"org_name","doubling_h","growth_tmp","reference","tax_id","name_class","ref_type"
"Syntrophus aciditrophicus",27,37,"Mouttaki, H., M.A. NannyM.J. McInerney (2008) Use of benzoate as an electron acceptor by Syntrophus aciditrophicus grown in pure culture with crotonate. Environmental Microbiology. 10(12): p. 3265-3274, DOI: 10.1111/j.1462-2920.2008.01716.x.",316277,"scientific name","full_text"
"Thermoplasma acidophilum",2.8,59,"Freisleben, H.-J., L. Henkel, R. Gutermann, P. Rudolph, G. John, et al. (1994) Fermentor cultivation of Thermoplasma acidophilum for the production of cell mass and of the main phospholipid fraction. Applied microbiology and biotechnology. 40(5): p. 745-752.",2303,"scientific name","full_text"
"Thermoplasma volcanium",3.6,60,"Kawashima, T., K. Yokoyama, S. HiguchiM. Suzuki (2005) Identification of proteins present in the archaeon Thermoplasma volcanium cultured in aerobic or anaerobic conditions. Proceedings of the Japan Academy Series B-Physical and Biological Sciences. 81(6): p. 204-219, DOI: 10.2183/pjab.81.204.",50339,"scientific name","full_text"
"Thermosynechococcus elongatus BP-1",5.4,45," Iwai M, Katayama M, Ikeuchi M (2006) Absence of the psbH gene product destabilizes the Photosystem II complex and prevents association of the Photosystem II-X protein in the thermophilic cyanobacterium Thermosynechococcus elongatus BP-1. Photosynthesis Research 87: 313-322.",197221,"scientific name","full_text"
"Thermotoga maritima",1.2,80," Chhabra SR, Shockley KR, Ward DE, Kelly RM (2002) Regulation of endo-acting glycosyl hydrolases in the hyperthermophilic bacterium Thermotoga maritima grown on glucan- and mannan-based polysaccharides. Appl Environ Microbiol 68: 545-554.",2336,"scientific name","full_text"
"Thermus thermophilus HB27",1.4,65," Demirtas MU, Kolhatkar A, Kilbane JJ, 2nd (2003) Effect of aeration and agitation on growth rate of Thermus thermophilus in batch mode. J Biosci Bioeng 95: 113-117.",262724,"scientific name","full_text"
"Thiomicrospira crunogena",0.87,25," Jannasch HW, Wirsen CO, Nelson DC, Robertson LA (1985) Thiomicrospira-Crunogena Sp-Nov, a Colorless, Sulfur-Oxidizing Bacterium from a Deep-Sea Hydrothermal Vent. International Journal of Systematic Bacteriology 35: 422-424.",39765,"synonym","full_text"
"Treponema denticola ATCC 35405",4.95,37," Dollhopf SL, Pariseau ML, Hashsham SA, Tiedje JM (2003) Competitive and interactions affecting a fermentative spirochete in anaerobic chemostats. Microb Ecol 46: 1-11.",243275,"scientific name","full_text"
"Treponema pallidum",25.5,33,"Fieldsteel, A.H., D.L. CoxR.A. Moeckli (1981) Cultivation of virulent Treponema pallidum in tissue culture. Infection and immunity. 32(2): p. 908-915.",160,"scientific name","full_text"
"Trichodesmium erythraeum",25,28," El-Shehawy R, Lugomela C, Ernst A, Bergman B (2003) Diurnal expression of hetR and diazocyte development in the filamentous non-heterocystous cyanobacterium Trichodesmium erythraeum. Microbiology 149: 1139-1146.",1206,"scientific name","full_text"
"Tropheryma whipplei str. Twist",28,37," Renesto P, Crapoulet N, Ogata H, La Scola B, Vestris G, et al. (2003) Genome-based design of a cell-free culture medium for Tropheryma whipplei. Lancet 362: 447-449.",203267,"scientific name","full_text"
"Ureaplasma urealyticum",1.5,37,"Sayed, I.G. Kenny (1978) Effect of ammonium ion concentration and osmotic pressure on growth of Ureaplasma urealyticum (T-strain mycoplasma). Journal of bacteriology. 134(3): p. 967-972.",2130,"scientific name","full_text"
"Vibrio cholerae",0.44,37,"Pradhan, S., A.K. Baidya, A. Ghosh, K. PaulR. Chowdhury (2010) The El Tor biotype of Vibrio cholerae exhibits a growth advantage in the stationary phase in mixed cultures with the classical biotype. Journal of bacteriology. 192(4): p. 955-963.",666,"scientific name","full_text"
"Vibrio fischeri ES114",0.5,25,"Ruby, E.L. Asato (1993) Growth and flagellation of Vibrio fischeri during initiation of the sepiolid squid light organ symbiosis. Archives of microbiology. 159(2): p. 160-167.",312309,"scientific name","full_text"
"Vibrio parahaemolyticus",0.23,35," Twedt RM, Novelli RM (1971) Modified selective and differential isolation medium for Vibrio parahaemolyticus. Appl Microbiol 22: 593-599.",670,"scientific name","full_text"
"Vibrio vulnificus CMCP6",0.25,37,"Starks, A.M., K.L. Bourdage, P.C. ThiavilleP.A. Gulig (2006) Use of a marker plasmid to examine differential rates of growth and death between clinical and environmental strains of Vibrio vulnificus in experimentally infected mice. Molecular Microbiology. 61(2): p. 310-323, DOI: 10.1111/j.1365-2958.2006.05227.x.",216895,"scientific name","full_text"
"Wigglesworthia glossinidia endosymbiont of Glossina brevipalpis",NA,NA,NA,36870,"scientific name","full_text"
"Wolbachia endosymbiont strain TRS of Brugia malayi",14,28," Fenollar F, Maurin M, Raoult D (2003) Wolbachia pipientis growth kinetics and susceptibilities to 13 antibiotics determined by immunofluorescence staining and real-time PCR. Antimicrob Agents Chemother 47: 1665-1671.",292805,"scientific name","full_text"
"Wolinella succinogenes",1,37," Ullmann R, Gross R, Simon J, Unden G, Kroger A (2000) Transport of C(4)-dicarboxylates in Wolinella succinogenes. J Bacteriol 182: 5757-5764.",844,"scientific name","full_text"
"Xanthomonas axonopodis",4.45,28,"Kousik, C.S.D.F. Ritchie (1996) Disease potential of pepper bacterial spot pathogen races that overcome the Bs2 gene for resistance. Phytopathology. 86(12): p. 1336-1343.",53413,"scientific name","full_text"
"Xanthomonas campestris",4.62,28," Pena C, Galindo E, Diaz M (2002) Effectiveness factor in biological external convection: study in high viscosity systems. J Biotechnol 95: 1-12.",339,"scientific name","full_text"
"Xanthomonas oryzae pv. oryzae KACC 10331",4.5,28,"Kim, S.-Y., B.-M. LeeJ.-Y. Cho (2010) Relationship between glucose catabolism and xanthan production in Xanthomonas oryzae pv. oryzae. Biotechnology Letters. 32(4): p. 527-531, DOI: 10.1007/s10529-009-0193-0.",291331,"scientific name","full_text"
"Xylella fastidiosa 9a5c",5.13,28," Feil H, Purcell AH (2001) Temperature-dependent growth and survival of Xylella fastidiosa in vitro and in potted grapevines. Plant Disease 85: 1230-1234.",160492,"scientific name","full_text"
"Yersinia pestis CO92",0.85,37,"Sha, J., J.J. Endsley, M.L. Kirtley, S.M. Foltz, M.B. Huante, et al. (2011) Characterization of an F1 Deletion Mutant of Yersinia pestis CO92, Pathogenic Role of F1 Antigen in Bubonic and Pneumonic Plague, and Evaluation of Sensitivity and Specificity of F1 Antigen Capture-Based Dipsticks. Journal of Clinical Microbiology. 49(5): p. 1708-1715, DOI: 10.1128/jcm.00064-11.",214092,"scientific name","full_text"
"Yersinia pseudotuberculosis",2.54,28,"Palonen, E., M. Lindstrom, R. Karttunen, P. SomervuoH. Korkeala (2011) Expression of Signal Transduction System Encoding Genes of Yersinia pseudotuberculosis IP32953 at 28 degrees C and 3 degrees C. Plos One. 6(9), DOI: 10.1371/journal.pone.0025063.",633,"scientific name","full_text"
"Zymomonas mobilis",1.7,30,"Jobses, I.M.L.J.A. Roels (1986) The inhibition of the maximum specific growth and fermentation rate of Zymomonas-mobilis by ethanol. Biotechnology and Bioengineering. 28(4): p. 554-563, DOI: 10.1002/bit.260280412.",542,"scientific name","full_text"
