"org_name","doubling_h","growth_tmp","reference","tax_id","name_class","ref_type"
"Leptospira interrogans serovar Lai str. 56601",10.23,29,"Fontana, C., S. Crussard, N. Simon-Dufay, D. Pialot, N. Bomchil, et al. (2017) Use of flow cytometry for rapid and accurate enumeration of live pathogenic Leptospira strains. Journal of Microbiological Methods. 132: p. 34-40, DOI: 10.1016/j.mimet.2016.10.013.",189518,"scientific name","full_text"
"Listeria innocua Clip11262",0.47,30,"Houtsma, P.C., B.J.M. Kusters, J.C. Dewit, F.M. RomboutsM.H. Zwietering (1994) Modeling growth-rates of Listeria-innocua as a function of lactate concentration. International Journal of Food Microbiology. 24(1-2): p. 113-123, DOI: 10.1016/0168-1605(94)90111-2.",272626,"scientific name","full_text"
"Listeria monocytogenes EGD",1.5,37,"Gaillard, J.-L., P. Berche, J. Mounier, S. RichardP. Sansonetti (1987) In vitro model of penetration and intracellular growth of Listeria monocytogenes in the human enterocyte-like cell line Caco-2. Infection and immunity. 55(11): p. 2822-2829.",1334565,"scientific name","full_text"
"Mannheimia succiniciproducens MBEL55E",0.6,39," Song H, Lee JW, Choi S, You JK, Hong WH, et al. (2007) Effects of dissolved CO2 levels on the growth of Mannheimia succiniciproducens and succinic acid production. Biotechnol Bioeng 98: 1296-1304.",221988,"scientific name","full_text"
"Mesorhizobium loti",2.4,28," Fulchieri MM, Estrella MJ, Iglesias AA (2001) Characterization of Rhizobium loti strains from the Salado River Basin. Antonie Van Leeuwenhoek 79: 119-125.",381,"scientific name","full_text"
"Methanocaldococcus jannaschii",0.7,85,"Mukhopadhyay, B., E.F. JohnsonR.S. Wolfe (1999) Reactor-scale cultivation of the hyperthermophilic methanarchaeon Methanococcus jannaschii to high cell densities. Applied and Environmental Microbiology. 65(11): p. 5059-5065.",2190,"scientific name","full_text"
"Methanococcoides burtonii",20,23," Goodchild A, Saunders NF, Ertan H, Raftery M, Guilhaus M, et al. (2004) A proteomic determination of cold adaptation in the Antarctic archaeon, Methanococcoides burtonii. Mol Microbiol 53: 309-321.",29291,"scientific name","full_text"
"Methanopyrus kandleri",0.83,98,"Huber, R., M. Kurr, H.W. JannaschK.O. Stetter (1989) A novel group of abyssal methanogenic archaebacteria (Methanopyrus) growing at 110-degrees-c. Nature. 342(6251): p. 833-834, DOI: 10.1038/342833a0.",2320,"scientific name","full_text"
"Methanosarcina barkeri",8,37," Mazumder TK, Nishio N, Fukuzaki S, Nagai S (1986) Effect of Sulfur-Containing Compounds on Growth of Methanosarcina barkeri in Defined Medium. Appl Environ Microbiol 52: 617-622.",2208,"scientific name","full_text"
"Methanothermobacter thermautotrophicus",1,65," Schönheit P, Moll J, Thauer RK (1980) Growth parameters (Ks, ?max, Ys) of Methanobacterium thermoautotrophicum. Archives of Microbiology 127: 59-65.",145262,"scientific name","full_text"
"Methylobacillus flagellatus",0.85,42,"Baev, M., L. Chistoserdova, B. Polanuer, V. Sterkin, M. Kiriukhin, et al. (1992) Effect of formaldehyde on growth of obligate methylotroph Methylobacillus flagellatum in a substrate non-limited continuous culture. Archives of microbiology. 158(2): p. 145-148.",405,"scientific name","full_text"
"Methylobacterium extorquens",4.2,30," Van Dien SJ, Okubo Y, Hough MT, Korotkova N, Taitano T, et al. (2003) Reconstruction of C(3) and C(4) metabolism in Methylobacterium extorquens AM1 using transposon mutagenesis. Microbiology 149: 601-609.",408,"scientific name","full_text"
"Methylococcus capsulatus",1.87,45," Joergensen L, Degn H (1987) Growth-Rate and Methane Affinity of a Turbidostatic and Oxystatic Continuous Culture of Methylococcus-Capsulatus (Bath). Biotechnology Letters 9: 71-76.",414,"scientific name","full_text"
"Moorella thermoacetica",5,59," Byrer DE, Rainey FA, Wiegel J (2000) Novel strains of Moorella thermoacetica form unusually heat-resistant spores. Archives of Microbiology 174: 334-339.",1525,"scientific name","full_text"
"Mycobacterium avium subsp. paratuberculosis K-10",10,37," Falkinham JO, 3rd (2003) Factors influencing the chlorine susceptibility of Mycobacterium avium, Mycobacterium intracellulare, and Mycobacterium scrofulaceum. Appl Environ Microbiol 69: 5685-5689.",262316,"scientific name","full_text"
"Mycobacterium bovis AF2122/97",23.4,37," Dunn PL, North RJ (1995) Virulence Ranking of Some Mycobacterium-Tuberculosis and Mycobacterium-Bovis Strains According to Their Ability to Multiply in the Lungs, Induce Lung Pathology, and Cause Mortality in Mice. Infection and Immunity 63: 3428-3437.",233413,"scientific name","full_text"
"Mycobacterium leprae",240,37," Cole ST, Eiglmeier K, Parkhill J, James KD, Thomson NR, et al. (2001) Massive gene decay in the leprosy bacillus. Nature 409: 1007-1011.",1769,"scientific name","full_text"
"Mycobacterium tuberculosis",19,38," Dunn PL, North RJ (1995) Virulence Ranking of Some Mycobacterium-Tuberculosis and Mycobacterium-Bovis Strains According to Their Ability to Multiply in the Lungs, Induce Lung Pathology, and Cause Mortality in Mice. Infection and Immunity 63: 3428-3437.",1773,"scientific name","full_text"
"Mycoplasma capricolum",3.03,37,"Odriozola, J.M., E. Waitzkin, T.L. SmithK. Bloch (1978) Sterol requirement of Mycoplasma-capricolum. Proceedings of the National Academy of Sciences of the United States of America. 75(9): p. 4107-4109, DOI: 10.1073/pnas.75.9.4107.",2095,"scientific name","full_text"
"Mycoplasma gallisepticum str. R",2.45,37,"Kazama, S., T. YagihashiT. Nunoya (1986) Properties of Mycoplasma-gallisepticum grown in a medium supplemented with liposomes as a substitute for serum. Microbiology and Immunology. 30(9): p. 923-929.",233150,"scientific name","full_text"
"Mycoplasma genitalium",11.9,37,"Lluch-Senar, M., E. QuerolJ. Pinol (2010) Cell division in a minimal bacterium in the absence of ftsZ. Molecular Microbiology. 78(2): p. 278-289, DOI: 10.1111/j.1365-2958.2010.07306.x.",2097,"scientific name","full_text"
"Mycoplasma hyopneumoniae 232",6.4,37,"Meyns, T., D. Maes, D. Calus, S. Ribbens, J. Dewulf, et al. (2007) Interactions of highly and low virulent Mycoplasma hyopneumoniae isolates with the respiratory tract of pigs. Veterinary microbiology. 120(1): p. 87-95.",295358,"scientific name","full_text"
"Mycoplasma mobile 163K",3.2,25,"Rosengarten, R.H. Kirchhoff (1989) Growth morphology of Mycoplasma mobile 163K on solid surfaces: Reproduction, aggregation, and microcolony formation. Current Microbiology. 18(1): p. 15-22.",267748,"scientific name","full_text"
"Mycoplasma mycoides subsp. mycoides SC",1.7,37,"March, J.B., J. ClarkM. Brodlie (2000) Characterization of strains of Mycoplasma mycoides subsp mycoides small colony type isolated from recent outbreaks of contagious bovine pleuropneumonia in Botswana and Tanzania: Evidence for a new biotype. Journal of Clinical Microbiology. 38(4): p. 1419-1425.",44101,"scientific name","full_text"
"Mycoplasma pneumoniae",4.22,37,"Somerson, N.L., W.D. James, B.E. WallsR.M. Chanock (1967) Growth of Mycoplasma pneumoniae on a glass surface. Annals of the New York Academy of Sciences. 143(A1): p. 384-&, DOI: 10.1111/j.1749-6632.1967.tb27680.x.",2104,"scientific name","full_text"
"Mycoplasma pulmonis UAB CTIP",1,37,"Dybvig, K., J.W. Simecka, H.L. WatsonG.H. Cassell (1989) High-frequency variation in Mycoplasma-pulmonis colony size. Journal of Bacteriology. 171(9): p. 5165-5168.",272635,"scientific name","full_text"
"Myxococcus xanthus",4,30,"Kimura, Y., H. Saiga, H. HamanakaH. Matoba (2006) Myxococcus xanthus twin-arginine translocation system is important for growth and development. Archives of Microbiology. 184(6): p. 387-396, DOI: 10.1007/s00203-005-0067-3.",34,"scientific name","full_text"
"Nanoarchaeum equitans",0.75,90,"Jahn, U., M. Gallenberger, W. Paper, B. Junglas, W. Eisenreich, et al. (2008) Nanoarchaeum equitans and Ignicoccus hospitalis: New insights into a unique, intimate association of two archaea. Journal of Bacteriology. 190(5): p. 1743-1750, DOI: 10.1128/jb.01731-07.",160232,"scientific name","full_text"
"Neisseria gonorrhoeae FA 1090",0.58,37," Hopper S, Vasquez B, Merz A, Clary S, Wilbur JS, et al. (2000) Effects of the immunoglobulin A1 protease on Neisseria gonorrhoeae trafficking across polarized T84 epithelial monolayers. Infection and Immunity 68: 906-911.",242231,"scientific name","full_text"
"Neisseria meningitidis",0.72,37," Deeudom M, Koomey M, Moir JWB (2008) Roles of c-type cytochromes in respiration in Neisseria meningitidis. Microbiology-Sgm 154: 2857-2864.",487,"scientific name","full_text"
"Nitrobacter winogradskyi",16.08,28,"Mellbye, B.L., P.J. BottomleyL.A. Sayavedra-Soto (2015) Nitrite-oxidizing bacterium Nitrobacter winogradskyi produces N-acyl-homoserine lactone autoinducers. Applied and environmental microbiology. 81(17): p. 5917-5926.",913,"scientific name","full_text"
"Nitrosomonas europaea ATCC 19718",5.5,25,"Sato, C., J.L. Schnoor, D.B. McDonaldJ. Huey (1985) Test medium for the growth of Nitrosomonas europaea. Applied and environmental microbiology. 49(5): p. 1101-1107.",228410,"scientific name","full_text"
"Nocardia farcinica",NA,NA," Heinzen RJ, Ensign JC (1975) Effect of growth substrates on morphology of Nocardia corallina. Arch Microbiol 103: 209-217.",37329,"scientific name","full_text"
"Nostoc sp. PCC 7120",16,28,"Summers, M.L., J.G. Wallis, E.L. CampbellJ.C. Meeks (1995) Genetic evidence of a major role for glucose-6-phosphate dehydrogenase in nitrogen fixation and dark growth of the cyanobacterium Nostoc sp. strain ATCC 29133. Journal of Bacteriology. 177(21): p. 6184-6194.",103690,"scientific name","full_text"
"Oenococcus oeni",10.5,25," Zhang DS, Lovitt RW (2005) Studies on growth and metabolism of Oenococcus oeni on sugars and sugar mixtures. Journal of Applied Microbiology 99: 565-572.",1247,"scientific name","full_text"
"Paenarthrobacter aurescens",2,30," Strong LC, Rosendahl C, Johnson G, Sadowsky MJ, Wackett LP (2002) Arthrobacter aurescens TC1 metabolizes diverse s-triazine ring compounds. Appl Environ Microbiol 68: 5973-5980.",43663,"scientific name","full_text"
"Paracoccus denitrificans",2.1,30," Blaszczyk M (1993) Effect of Medium Composition on the Denitrification of Nitrate by Paracoccus denitrificans. Appl Environ Microbiol 59: 3951-3953.",266,"scientific name","full_text"
"Pasteurella multocida subsp. multocida str. Pm70",1,37," Xia X, Wei T, Xie Z, Danchin A (2002) Genomic changes in nucleotide and dinucleotide frequencies in Pasteurella multocida cultured under high temperature. Genetics 161: 1385-1394.",272843,"scientific name","full_text"
"Pectobacterium atrosepticum",2.31,28,"Smadja, B., X. Latour, S. Trigui, J. Burini, S. Chevalier, et al. (2004) Thermodependence of growth and enzymatic activities implicated in pathogenicity of two Erwinia carotovora subspecies (Pectobacterium spp.). Canadian Journal of Microbiology. 50(1): p. 19-27, DOI: 10.1139/w03-099.",29471,"scientific name","full_text"
"Petrotoga mobilis",12,60," Lien T, Madsen M, Rainey FA, Birkeland NK (1998) Petrotoga mobilis sp. nov., from a North Sea oil-production well. International Journal of Systematic Bacteriology 48: 1007-1013.",69499,"scientific name","full_text"
"Photobacterium profundum SS9",1.7,10,"Nogi, Y., N. MasuiC. Kato (1998) Photobacterium profundum sp. nov., a new, moderately barophilic bacterial species isolated from a deep-sea sediment. Extremophiles. 2(1): p. 1-7, DOI: 10.1007/s007920050036.",298386,"scientific name","full_text"
"Photorhabdus luminescens subsp. laumondii TTO1",0.73,28,"Bowen, M., D. Co, F. Inman IIIL. Holmes (2012) Microbial kinetics of Photorhabdus luminescens in glucose batch cultures. Explorations: The Journal of Undergraduate Research and Creative Activities for the State of North Carolina. 7: p. 14-22.",243265,"scientific name","full_text"
"Picrophilus torridus DSM 9790",6,60," Schleper C, Puehler G, Holz I, Gambacorta A, Janekovic D, et al. (1995) Picrophilus Gen-Nov, Fam-Nov - a Novel Aerobic, Heterotrophic, Thermoacidophilic Genus and Family Comprising Archaea Capable of Growth around Ph-0. Journal of Bacteriology 177: 7050-7059.",263820,"scientific name","full_text"
"Porphyromonas gingivalis W83",2.56,37," Marsh PD, McDermid AS, McKee AS, Baskerville A (1994) The effect of growth rate and haemin on the virulence and proteolytic activity of Porphyromonas gingivalis W50. Microbiology 140: 861-865.",242619,"scientific name","full_text"
"Prochlorococcus marinus subsp. marinus str. CCMP1375",16.8,26," Shalapyonok A, Olson RJ, Shalapyonok LS (1998) Ultradian Growth in Prochlorococcus spp. Appl Environ Microbiol 64: 1066-1069.",167539,"scientific name","full_text"
"Propionibacterium acnes KPA171202",5.1,35,"Hall, G.S., K. Prattrippin, D.M. Meisler, J.A. Washington, T.J. Roussel, et al. (1994) Growth curve for Propionibacterium-acnes. Current Eye Research. 13(6): p. 465-466, DOI: 10.3109/02713689408999875.",267747,"scientific name","full_text"
"Pseudoalteromonas haloplanktis",2.04,15,"Giuliani, M., E. Parrilli, P. Ferrer, K. Baumann, C. Marino, et al. (2011) Process optimization for recombinant protein production in the psychrophilic bacterium Pseudoalteromonas haloplanktis. Process Biochemistry. 46(4): p. 953-959, DOI: 10.1016/j.procbio.2011.01.011.",228,"scientific name","full_text"
"Pseudomonas aeruginosa PAO1",0.33,37,"Hooke, A.M., D. Sordelli, M. CerquettiA. Vogt (1985) Quantitative determination of bacterial replication in vivo. Infection and immunity. 49(2): p. 424-427.",208964,"scientific name","full_text"
"Pseudomonas putida KT2440",1.11,24," Ahn IS, Ghiorse WC, Lion LW, Shuler ML (1998) Growth kinetics of Pseudomonas putida G7 on naphthalene and occurrence of naphthalene toxicity during nutrient deprivation. Biotechnol Bioeng 59: 587-594.",160488,"scientific name","full_text"
"Pseudomonas syringae pv. tomato DC3000",1.67,30.7," Keith LM, Partridge JE, Bender CL (1999) dnaK and the heat stress response of Pseudomonas syringae pv. glycinea. Mol Plant Microbe Interact 12: 563-574.",223283,"equivalent name","full_text"
"Psychromonas ingrahamii",12,5," Breezee J, Cady N, Staley JT (2004) Subfreezing growth of the sea ice bacterium ""Psychromonas ingrahamii"". Microb Ecol 47: 300-304.",357794,"scientific name","full_text"
"Pyrobaculum aerophilum",3,100,"Völkl, P., R. Huber, E. Drobner, R. Rachel, S. Burggraf, et al. (1993) Pyrobaculum aerophilum sp. nov., a novel nitrate-reducing hyperthermophilic archaeum. Applied and Environmental Microbiology. 59(9): p. 2918-2926.",13773,"scientific name","full_text"
"Pyrobaculum arsenaticum",1.35,95,"Huber, R., M. Sacher, A. Vollmann, H. HuberD. Rose (2000) Respiration of arsenate and selenate by hyperthermophilic archaea. Systematic and Applied Microbiology. 23(3): p. 305-314.",121277,"scientific name","full_text"
"Pyrococcus abyssi",0.55,96,"Erauso, G., A.L. Reysenbach, A. Godfroy, J.R. Meunier, B. Crump, et al. (1993) Pyrococcus-abyssi sp-nov, a new hyperthermophilic archaeon isolated from a deep-sea hydrothermal vent. Archives of Microbiology. 160(5): p. 338-349.",29292,"scientific name","full_text"
"Pyrococcus furiosus",0.62,100,"Fiala, G.K.O. Stetter (1986) Pyrococcus furiosus sp. nov. represents a novel genus of marine heterotrophic archaebacteria growing optimally at 100 C. Archives of Microbiology. 145(1): p. 56-61.",2261,"scientific name","full_text"
"Pyrococcus horikoshii",0.53,98,"González, J.M., Y. Masuchi, F.T. Robb, J.W. Ammerman, D.L. Maeder, et al. (1998) Pyrococcus horikoshii sp. nov., a hyperthermophilic archaeon isolated from a hydrothermal vent at the Okinawa Trough. Extremophiles. 2(2): p. 123-130.",53953,"scientific name","full_text"
"Ralstonia solanacearum GMI1000",1,28,"Stevens, P., L.S. van OverbeekJ.D. van Elsas (2011) Ralstonia solanacearum ?PGI-1 strain KZR-5 is affected in growth, response to cold stress and invasion of tomato. Microbial ecology. 61(1): p. 101-112.",267608,"scientific name","full_text"
"Rhodobacter sphaeroides",3.4,27,"Nishimura, K., H. Shimada, S. Hatanaka, H. Mizoguchi, H. Ohta, et al. (1998) Growth, pigmentation, and expression of the puf and puc operons in a light-responding-repressor (SPB)-disrupted Rhodobacter sphaeroides. Plant and Cell Physiology. 39(4): p. 411-417.",1063,"scientific name","full_text"
"Rhodococcus jostii",5.3,30," Navarro-Llorens JM, Patrauchan MA, Stewart GR, Davies JE, Eltis LD, et al. (2005) Phenylacetate catabolism in Rhodococcus sp. strain RHA1: a central pathway for degradation of aromatic compounds. J Bacteriol 187: 4497-4504.",132919,"scientific name","full_text"
"Rhodoferax ferrireducens",22.7,25,"Chaudhuri, S.K.D.R. Lovley (2003) Electricity generation by direct oxidation of glucose in mediatorless microbial fuel cells. Nature biotechnology. 21(10): p. 1229.",192843,"scientific name","full_text"
"Rhodopirellula baltica",10,25," Rabus R, Gade D, Helbig R, Bauer M, Glockner FO, et al. (2002) Analysis of N-acetylglucosamine metabolism in the marine bacterium Pirellula sp. strain 1 by a proteomic approach. Proteomics 2: 649-655.",265606,"scientific name","full_text"
"Rhodopseudomonas palustris",10.7,30,"Van der Woude, B., M. De Boer, N. Van der Put, F. Van der Geld, R. Prins, et al. (1994) Anaerobic degradation of halogenated benzoic acids by photoheterotrophic bacteria. FEMS microbiology letters. 119(1-2): p. 199-207.",1076,"scientific name","full_text"
"Rhodospirillum rubrum",3.8,30," Kerby RL, Ludden PW, Roberts GP (1995) Carbon Monoxide-Dependent Growth of Rhodospirillum-Rubrum. Journal of Bacteriology 177: 2241-2244.",1085,"scientific name","full_text"
"Rickettsia conorii str. Malish 7",4,37,"Manor, E.I. Sarov (1990) Inhibition of Rickettsia-conorii growth by recombinant tumor necrosis factor-alpha - enhancement of inhibition by gamma-interferon. Infection and Immunity. 58(6): p. 1886-1890.",272944,"scientific name","full_text"
"Rickettsia prowazekii",8.8,34," Pang H, Winkler HH (1994) The concentrations of stable RNA and ribosomes in Rickettsia prowazekii. Mol Microbiol 12: 115-120.",782,"scientific name","full_text"
"Rickettsia typhi str. Wilmington",17.6,34,"Keysary, A., A. Itzhaki, E. Rubinstein, C. OronG. Keren (1996) The in-vitro anti-rickettsial activity of macrolides. Journal of Antimicrobial Chemotherapy. 38(4): p. 727-731, DOI: 10.1093/jac/38.4.727.",257363,"scientific name","full_text"
"Rubrobacter xylanophilus",4.3,60," Empadinhas N, Mendes V, Simões C, Santos M, Mingote A, et al. (2007) Organic solutes in Rubrobacter xylanophilus : the first example of di- myo -inositol-phosphate in a thermophile. Extremophiles 11: 667-673.",49319,"scientific name","full_text"
"Ruegeria pomeroyi",1.65,30," Gonzalez JM, Covert JS, Whitman WB, Henriksen JR, Mayer F, et al. (2003) Silicibacter pomeroyi sp. nov. and Roseovarius nubinhibens sp. nov., dimethylsulfoniopropionate-demethylating bacteria from marine environments. Int J Syst Evol Microbiol 53: 1261-1269.",89184,"scientific name","full_text"
"Salinibacter ruber",14,37," Anton J, Oren A, Benlloch S, Rodriguez-Valera F, Amann R, et al. (2002) Salinibacter ruber gen. nov., sp nov., a novel, extremely halophilic member of the Bacteria from saltern crystallizer ponds. International Journal of Systematic and Evolutionary Microbiology 52: 485-491.",146919,"scientific name","full_text"
"Salmonella enterica subsp. enterica serovar Typhimurium str. LT2",0.37,37,"Berry, L.J., M.K. Deropp, M.H. FairE.M. Schur (1956) Dynamics of bacterial infections in mice under conditions known to alter survival time. Journal of Infectious Diseases. 98(2): p. 198-207.",99287,"scientific name","full_text"
"Shewanella oneidensis MR-1",0.75,22," Abboud R, Popa R, Souza-Egipsy V, Giometti CS, Tollaksen S, et al. (2005) Low-temperature growth of Shewanella oneidensis MR-1. Appl Environ Microbiol 71: 811-816.",211586,"scientific name","full_text"
"Sinorhizobium meliloti 1021",1.5,30," Ampe F, Kiss E, Sabourdy F, Batut J (2003) Transcriptome analysis of Sinorhizobium meliloti during symbiosis. Genome Biol 4: R15.",266834,"scientific name","full_text"
"Sodalis glossinidius",26,26.5," Matthew CZ, Darby AC, Young SA, Hume LH, Welburn SC (2005) The rapid isolation and growth dynamics of the tsetse symbiont Sodalis glossinidius. FEMS Microbiol Lett 248: 69-74.",63612,"scientific name","full_text"
"Sorangium cellulosum",6,34,"Pradella, S., A. Hans, C. Spröer, H. Reichenbach, K. Gerth, et al. (2002) Characterisation, genome size and genetic manipulation of the myxobacterium Sorangium cellulosum So ce56. Archives of microbiology. 178(6): p. 484-492.",56,"scientific name","full_text"
"Sphingopyxis alaskensis",3.3,30,"Ostrowski, M., R. Cavicchioli, M. BlaauwJ.C. Gottschal (2001) Specific growth rate plays a critical role in hydrogen peroxide resistance of the marine oligotrophic ultramicrobacterium Sphingomonas alaskensis strain RB2256. Applied and Environmental Microbiology. 67(3): p. 1292-1299, DOI: 10.1128/aem.67.3.1292-1299.2001.",117207,"scientific name","full_text"
"Staphylococcus aureus subsp. aureus N315",0.48,37," Somerville GA, Said-Salim B, Wickman JM, Raffel SJ, Kreiswirth BN, et al. (2003) Correlation of acetate catabolism and growth yield in Staphylococcus aureus: implications for host-pathogen interactions. Infect Immun 71: 4724-4732.",158879,"scientific name","full_text"
"Staphylococcus epidermidis ATCC 12228",0.33,36," Gottenbos B, van der Mei H, Busscher H (2000) Initial adhesion and surface growth of Staphylococcus epidermidis and Pseudomonas aeruginosa on biomedical polymers. J Biomed Materials Res 50: 208-214.",176280,"scientific name","full_text"
"Staphylothermus marinus",6.3,85," Hao X, Ma K (2003) Minimal sulfur requirement for growth and sulfur-dependent metabolism of the hyperthermophilic archaeon Staphylothermus marinus. Archaea 1: 191-197.",2280,"scientific name","full_text"
"Streptococcus agalactiae 2603V/R",0.8,37,"Paoletti, L.C., R.A. RossK.D. Johnson (1996) Cell growth rate regulates expression of group B Streptococcus type III capsular polysaccharide. Infection and Immunity. 64(4): p. 1220-1226.",208435,"scientific name","full_text"
"Streptococcus mutans UA159",1.1,37,"Beckers, H.J.A.J.S. van der Hoeven (1982) Growth-rates of Actinomyces-viscosus and Streptococcus-mutans during early colonization of tooth surfaces in gnotobiotic-rats. Infection and Immunity. 35(2): p. 583-587.",210007,"scientific name","full_text"
"Streptococcus pneumoniae TIGR4",0.52,37," Small PM, Tauber MG, Hackbarth CJ, Sande MA (1986) Influence of body temperature on bacterial growth rates in experimental pneumococcal meningitis in rabbits. Infect Immun 52: 484-487.",170187,"scientific name","full_text"
"Streptococcus pyogenes serotype M1",0.42,37," Biswas I, Germon P, McDade K, Scott JR (2001) Generation and surface localization of intact M protein in Streptococcus pyogenes are dependent on sagA. Infect Immun 69: 7029-7038.",301447,"scientific name","full_text"
"Streptococcus thermophilus LMG 18311",0.4,42," O'Sullivan TF, Fitzgerald GF (1999) Electrotransformation of industrial strains of Streptococcus thermophilus. J Appl Microbiol 86: 275-283.",264199,"scientific name","full_text"
"Streptomyces coelicolor A3(2)",2.04,30," Shahab N, Flett F, Oliver SG, Butler PR (1996) Growth rate control of protein and nucleic acid content in Streptomyces coelicolor A3(2) and Escherichia coli B/r. Microbiology 142: 1927-1935.",100226,"scientific name","full_text"
"Sulfolobus acidocaldarius",4.95,70,"Ju, L.K.P. Kankipati (1998) Toxicity of dibenzothiophene to thermophile Sulfolobus acidocaldarius grown in sucrose medium. Journal of Biotechnology. 63(3): p. 219-227, DOI: 10.1016/s0168-1656(98)00089-3.",2285,"scientific name","full_text"
"Sulfolobus solfataricus",5,87,"De Rosa, M., A. Gambacorta, B. Nicolaus, P. Giardina, E. Poerio, et al. (1984) Glucose metabolism in the extreme thermoacidophilic archaebacterium Sulfolobus solfataricus. Biochemical Journal. 224(2): p. 407-414.",2287,"scientific name","full_text"
"Sulfolobus tokodaii",7.4,80,"Jensen, S.M., V.L. Neesgaard, S.L.N. Skjoldbjerg, M. Brandl, C.S. Ejsing, et al. (2015) The effects of temperature and growth phase on the lipidomes of Sulfolobus islandicus and Sulfolobus tokodaii. Life. 5(3): p. 1539-1566.",111955,"scientific name","full_text"
"Symbiobacterium thermophilum",2.41,60," Ohno M, Okano I, Watsuji T, Kakinuma T, Ueda K, et al. (1999) Establishing the independent culture of a strictly symbiotic bacterium Symbiobacterium thermophilum from its supporting Bacillus strain. Biosci Biotechnol Biochem 63: 1083-1090.",2734,"scientific name","full_text"
"Synechococcus elongatus PCC 6301",5.4,38,"Yu, J., M. Liberton, P.F. Cliften, R.D. Head, J.M. Jacobs, et al. (2015) Synechococcus elongatus UTEX 2973, a fast growing cyanobacterial chassis for biosynthesis using light and CO2. Scientific reports. 5.",269084,"scientific name","full_text"
"Synechococcus sp. WH 8102",10.3,30," Mori T, Binder B, Johnson CH (1996) Circadian gating of cell division in cyanobacteria growing with average doubling times of less than 24 hours. Proc Natl Acad Sci U S A 93: 10183-10188.",84588,"scientific name","full_text"
"Synechocystis sp. PCC 6803",12,30," Johnson TW, Shen G, Zybailov B, Kolling D, Reategui R, et al. (2000) Recruitment of a foreign quinone into the A(1) site of photosystem I. I. Genetic and physiological characterization of phylloquinone biosynthetic pathway mutants in Synechocystis sp. pcc 6803. J Biol Chem 275: 8523-8530.",1148,"scientific name","full_text"
"Syntrophobacter fumaroxidans",98,37," Harmsen HJM, Van Kuijk BLM, Plugge CM, Akkermans ADL, De Vos WM, et al. (1998) Syntrophobacter fumaroxidans sp. nov., a syntrophic propionate-degrading sulfate-reducing bacterium. International Journal of Systematic Bacteriology 48: 1383-1387.",119484,"scientific name","full_text"
